,productID,description,title,imUrl,related,salesRank,categories,price,brand
98773,B0051COPFI,"Our founder Jennifer Broe Jen loves fresh carrot-apple juice. She wanted her babies to enjoy this unique fresh flavor, along with the sweetness and 'side benefits' of prunes.  Jen wanted to feed her babies food that was healthy and tasty, but was disappointed by grocery store options.  She started making her own baby food based on home-tested and much-loved family recipes. And so - Baby Gourmet was born.  Baby Gourmet is Moms' secret to getting babies to love what's good for them.  As President, Jen oversees every aspect of Baby Gourmet with the passionate and watchful eye of a mother and a business person. Founded on a mother&#x2019;s love and fuelled by an unwavering commitment to quality, we make the best-tasting healthy, organic baby food on the market.","Baby Gourmet Organic Simple Purees Stage 1 (6 Months+) Orchard, Apple, Carrot and Prune Baby Food, 4.5-Ounce Pouches (Pack of 12)",http://ecx.images-amazon.com/images/I/51dX8yJHw6L._SY300_.jpg,"{'also_bought': ['B0031UBXDE', 'B0044CZ63G', 'B0030VBQGS', 'B0051COQ2K', 'B0030VBRCG', 'B004N5E7GQ', 'B0030VJ79Q', 'B008I1WSV2', 'B005LTHR7O', 'B0044BQXDE', 'B008I1X0NC', 'B005MHRB7G', 'B008XK76G0', 'B005LTHRLA', 'B0026KJPYE', 'B00BN1U4SI', 'B001NXM3I0', 'B00EFBHULW', 'B007WP44HQ', 'B000ER6Y54', 'B00886QBHE', 'B0083ZZFE0', 'B0030VBRIU', 'B000ER1CUG', 'B00BPNRIR4', 'B0047ORGWK', 'B001BLZVQ0', 'B0090DXWXA', 'B000ER1DDW', 'B001BM368E', 'B00B5BKJ6S', 'B00975I0RE', 'B001DBRU4O', 'B004PXCGWI', 'B00AR5DOJM', 'B0031UBVX6', 'B00EO9XPN2', 'B001BM395E', 'B008I1X32K', 'B005O8BJU8', 'B000YSS7EO', 'B005OCYNP2', 'B0030VBSBG', 'B00622CYTK', 'B005MFIR5S', 'B0090DYH20', 'B00355ANDG', 'B002DW4R9S', 'B00BPNRGEE', 'B004ET9OIW', 'B007KXO970', 'B00BN1U7W6', 'B009TJ3J60', 'B005M6E1DY', 'B009EQFS5I', 'B000FPGZFY', 'B001PGKPNK', 'B004OBIYR2', 'B004KUV136', 'B00355CLLS', 'B0031B5CEE'], 'also_viewed': ['B0030VBQGS', 'B0030VJ79Q', 'B0044CZ63G', 'B0051COQ2K', 'B00CFCTE2Q', 'B005MHRB7G', 'B00EFBHULW', '1615190708', 'B0083ZZFE0']}",{'Grocery & Gourmet Food': 131054},[['Grocery & Gourmet Food']],,
102393,B005CT9OYM,,"Knorr Roasters Roasting Bag and Seasoning Blend for Chicken, Garlic Parmesan and Italian Herb, 1.02 Ounce Packages (Pack of 12)",http://ecx.images-amazon.com/images/I/51Ua7cPqmhL._SY300_.jpg,"{'also_bought': ['B001SAZU5Q', 'B000EXMP7O', 'B000EXMP74', 'B00437I580', 'B00E9NZ9IW', 'B000I2OOPW', 'B005AXUA98', 'B00099XOVE', 'B00099XOQ4', 'B007R0QXYS', 'B00099XOVO', 'B000EXMP7E', 'B008GZ1B3Q', 'B000HZEST2', 'B000LM495E', 'B000EM6Q34', 'B003TRL87U', 'B0057OOMEO', 'B003U6FK9M', 'B000I2OOQG', 'B000EM6Q20', 'B00AQM73NY', 'B00AQM76K4', 'B005VBD46U', 'B003EXVM70', 'B000NY31EU', 'B00HFYGQHU', 'B000I2OOPC', 'B001EQ59C8'], 'also_viewed': ['B005AXUA98', 'B005VHF7HS', 'B007R0QXYS', 'B000LM495E', 'B007H4Q58I', 'B0007M45XE', 'B00099XOVE', 'B00HFN70B2', 'B00D2GWLVA', 'B001SAZU5Q', 'B000EM8UO2', 'B003OJ0MU2']}",{'Grocery & Gourmet Food': 88583},[['Grocery & Gourmet Food']],,
104591,B005HG9ERW,"Essentia Water provides unmatched hydration, health benefits and smooth taste.  Its superior hydrating qualities come from a special electrolyte formula and optimal pH level of 9.5, which gives your body more of what it needs to thrive. Drinking Essentia Water boosts the antioxidant properties of your immune system and helps bring your body back into balance. It also helps maintain normal blood pressure, restful sleep, heart health, muscle strength and more.","Essentia 9.5 pH Drinking Water, 20-Ounce (Pack of 24)",http://ecx.images-amazon.com/images/I/41ThqnmiBzL._SY300_.jpg,"{'also_bought': ['B004LL7EBM', 'B004748SUY', 'B004CQWWKY', 'B00BY7423O', 'B00HSPMZRG', 'B00CIZ8NHM', 'B008JGK55C', 'B000LL0R8I', 'B00FPE563C', 'B003FDG4K4', 'B00A2TL9TK', 'B0083TTBWS', 'B00ASBOP9S', 'B008EIY0F6', 'B0017T6S2W', 'B007PE7ANY', 'B001EBBKNU', 'B00A1MQI58', 'B009IQLJFM', 'B0038B3AAK', 'B001LTZ7P2', 'B00HFQ2T06', 'B008UQLZ5A', 'B003Q4V6U0', 'B0088MXS6U', 'B00CE4CRG0', 'B008AHJZTM', 'B0089VNS5G', 'B008JKU2CO', 'B009AH7OU8', 'B001E3WT06', 'B00F9VCQ2A', 'B001ET76AI', 'B002ANBNKG', 'B0098IMTIG', 'B007R8XGKE', 'B0017U9VIO', 'B0046HJN5G', 'B009M2L6QE', 'B004H2YASK', 'B0029XQKAU', 'B0079J3TXU', 'B00JWXMYUU', 'B007UZNS5W', 'B0013OVYCA', 'B00EPTYHGA', 'B000VK6TKO', 'B004FICLJQ', 'B003YZE5ZY', 'B00401P0IC', 'B003P02EGU', 'B0083QJU72', 'B004TJD72Q', 'B000MTST70', 'B00CY0RR3C', 'B003QQ4BP0', 'B004I2FGQE', 'B005JAT318', 'B00DNYXJP8', 'B00835PYFK', 'B0033WT4ZO', 'B0074FFY3M', 'B003QNLUTI', 'B003SBRS12', 'B005JXHLBY', 'B007UZNR1C', 'B008MIGHFE', 'B007LEO4Y6', 'B00BFUSDO4', 'B0046CMBK0', 'B005MER0RA', 'B003PDB79W', 'B000BD0SDU', 'B001P22GHC', 'B000PG8KGU', 'B0091DS0UY', 'B009IJ5JC8', 'B00DOSANPW', 'B001CGTN1I', 'B003LPMC3O', 'B002YD8GBG', 'B0013OVVFA', 'B001E52Z58', 'B004S0DZ8W', 'B003DI98D6', 'B009D6ZLR4', 'B007MI2RI6', 'B0013OUKTS', 'B005P0U7TY', 'B005N7EUSS', 'B00BV4HEE4', 'B002FWTEYY', 'B00HSC9F2C', 'B00BLZ2312', 'B00BP36RTY', 'B002HI1LSI', 'B001534R00'], 'also_viewed': ['B004LL7EBM', 'B004CQWWKY', 'B001HTKPGC', 'B00BY7423O', 'B008JGK55C', 'B00FPE563C', 'B004748SUY', 'B001EBBKNU', 'B0083TTBWS', 'B004S891KU', 'B00FFL9OK6', 'B002F5732Q', 'B00926CJT8', 'B00EYKIAOA', 'B00HUCIOA4', 'B00E8MOB3S', 'B00E8MG6IQ', 'B0053YL98K', 'B005B2YTFO', 'B00IMIDI3S', 'B001E3WT06', 'B00A1FVVC0', 'B006H4PEZE', 'B00474ALEU', 'B005T1302A', 'B004PBBSXS', 'B008JGK4U8', 'B009VD442C', 'B001SB4JU2', 'B008SBDZRS', 'B00451SU3E', 'B00A1FHVCY', 'B00HVJ1LGU', 'B0055B0RCK', 'B00CXB8D8K', 'B004748F2A', 'B0047459CY', 'B000JJMVM2', 'B00CXB8DLC', 'B00KK90R1I', 'B0069FTP0G', 'B004ZEYKNA', 'B003105N9Y', 'B008D7T5DK', 'B00HNJWW20', 'B005T12ZXK', 'B0039LWD5M', 'B0058T67CS', 'B00A1CERG0', 'B00ID7G8US', 'B001HTR2E0', 'B001HTE2CK', 'B002NDZKRU'], 'bought_together': ['B004CQWWKY']}",{'Grocery & Gourmet Food': 360},[['Grocery & Gourmet Food']],59.6,Essentia
104600,B005HGJ3ZK,"A gluten free meal that cooks directly from the cup. Add water and microwave for 3.5 minutes. Made from a certified gluten free facility with no genetically modified ingredients. Take it with you wherever you-work, school, plane, camping trips, restaurants, and more.","Pastariso Instant Brown Rice, Mac and Cheese Meal Cup, 2-Ounce (Pack of 6)",http://ecx.images-amazon.com/images/I/514CNAMBijL._SX300_.jpg,"{'also_bought': ['B003YBNKC2', 'B003ESRF5I', 'B000CQ01NS', 'B005OQB02C', 'B0036VLZS6', 'B0011MAQ6O', 'B001H828EK', 'B003TO9RSU', 'B004LQRNT0', 'B004391DK0', 'B00C1W77W4', 'B007ZZTQJO', 'B000F0BXCO', 'B0036VFXUM', 'B007TV43K6', 'B007TUZSR4'], 'also_viewed': ['B00D7D1YAW', 'B005LB8UCS', 'B000CQ01NS', 'B000AMPRBU', 'B0017U24KG', 'B00C1W77W4', 'B000LKXG8W', 'B000FFLTD2', 'B000E1FXQ6']}",{'Grocery & Gourmet Food': 98642},[['Grocery & Gourmet Food']],,
108654,B005V9YXTO,"A first of it's kind. A true Vegetable Chip, with no comparisons. Veggies include Kale, Sweet Potatoes, Carrots, Broccoli, Spinach and Tomatoes. This chip provides a crispy, crunch with great flavor giving it broad snackability. Eat Your Vegetables are in a proprietary shape perfect for dipping and with a proprietary formula led by navy beans, sweet potatoes and carrots. Available in 5 flavors.","Eat Your Vegetables Sea Salt Veggie Chips, 4.5-Ounce (Pack of 6)",http://ecx.images-amazon.com/images/I/51nzMbwDcgL._SY300_.jpg,"{'also_bought': ['B0065Q97TI', 'B00D2PXR46', 'B00C25LO8S', 'B00F94YP8U', 'B00DBSFXUA', 'B000MVIGSK', 'B007VCF1SQ', 'B008ELO6KC', 'B00A48LU5M', 'B00BTZT1Q4', 'B007POA2L6', 'B00CY1B3R2', 'B001PICX42', 'B00BN1U7W6', 'B000HDOQ5U', 'B007POA176', 'B007POA19O', 'B00CVTFS5U', 'B00BKL4KKY', 'B0038B38BQ', 'B00DILE51I', 'B008RWUK6W', 'B000HDKZK0', 'B008JKU2CO', 'B006XK2WIO', 'B008KHX548', 'B00CD4AZM4', 'B004BRCF60', 'B0044CZ63G', 'B000F70OXG', 'B008JKUBZM', 'B00B044BNW', 'B008JA7CRW', 'B000CQ01NS', 'B004SEUA40', 'B003ZMXYMG', 'B001942GAI', 'B0030VJ79Q', 'B000HVX6NK', 'B005KG7U16', 'B00D7D1YAW', 'B003YBNKC2', 'B005H9289K', 'B009AEK8PO', 'B007PE7ANY', 'B0030VBRCG', 'B001CWSKFC'], 'also_viewed': ['B0065Q97TI', 'B00A48LU5M', 'B00CD4AZM4', 'B005UDEGCU', 'B005V9Z3KC', 'B00AQGJ6UI', 'B000EQYSLC', 'B009UQFDZC', 'B000MVIGSK', 'B00CD4AZLK', 'B00CBMB5EU', 'B0065Q986U', 'B006STMMZI', 'B0047277QC', 'B005V9YXSU', 'B00II9VSWY', 'B000V0EZZ0', 'B001IZICTC', 'B0041BSZGA', 'B00EAMTSX4', 'B00A0H9MSE', 'B00E1FS2VY', 'B00DYGPFPW', 'B000EQX6QK', 'B0078DPDX6', 'B007POA176', 'B0093JX9RA', 'B005P0WZ62', 'B004BY7HFC', 'B00GZFNRNG', 'B006XK2WIO', 'B00BFJ7GUW', 'B003A9S5JG', 'B004D693CS', 'B008JXI1VU', 'B009OY3WM6', 'B003DN0FTM', 'B004BRCF60', 'B009988JNE', 'B007POA158', 'B003AZ2ECY', 'B006QSWU08', 'B00F94YP8U', 'B005CW4O1M', 'B00CEXYZS4', 'B007POA2L6', 'B00CD4AZNS', 'B00GAB1KUM', 'B00AQGJ6YY', 'B00E3KJA18', 'B008JBDMO8', 'B00HGV5UBU', 'B007VCF1QI'], 'bought_together': ['B00C25LO8S']}",{'Grocery & Gourmet Food': 82161},[['Grocery & Gourmet Food']],40.44,Snikiddy Snacks
109359,B005XVZKGA,"What does purified water with natural caffeine taste like?&#xA0;Like nothing.&#xA0;Which is exactly the way water should taste.&#xA0;The healthy hydration you need with the caffeine lift you want!&#xA0;Avitae Caffeinated Water provides a new and better alternative to sugary beverages, soft drinks, energy drinks, and bottled water.&#xA0;Avitae contains 0 calories, sugars, or artificial ingredients.","avitae 90 Mg Caffeinated Water, 16.91-Ounce (Pack of 12)",http://ecx.images-amazon.com/images/I/41MUfHQvzYL._SY300_.jpg,"{'also_bought': ['B00CXWOIBK', 'B005580CAK', 'B004746M8O', 'B00CE4CRG0', 'B003H2QFI4', 'B001HTR2E0', 'B00474328W', 'B00401P0IC', 'B00D8YLMW0', 'B00473ZHY0', 'B002HQEY7K', 'B00HSY978M', 'B00HZ5Z4GI', 'B004CQWWKY', 'B00HFQ2T06', 'B0081XSTPG', 'B00F9VCQ2A', 'B007L04T8Q', 'B00IHVHM4Q', 'B005HG9ET0', 'B003SBRQAU', 'B003P02EGU', 'B009M2L6QE', 'B004I2FGQE', 'B000LL0R8I', 'B001LTZ7P2', 'B007UZNS5W', 'B0091U8WX2', 'B007PE7ANY', 'B0088MXS6U', 'B00CC6XSSQ', 'B00B2D0XLU'], 'also_viewed': ['B00CXWOIBK', 'B00CE4CRG0', 'B005580CAK', 'B004746M8O', 'B00474328W', 'B003H2QFI4', 'B00401P0IC', 'B00473ZHY0', 'B00A9OE03A', 'B001HTR2E0', 'B00B2D0XLU', 'B00BY7423O', 'B005L99402', 'B00J0LA3RA', 'B001CCL55O', 'B008R7I7PI', 'B005HG9ET0', 'B00B2D0XLK', 'B002HQEY7K', 'B00ABKL44K', 'B004ESILJQ', 'B00J8BIC34', 'B0045RYE0Q', 'B0051XY1YM', 'B00B2D0XN8', 'B00B2D0YHS', 'B00CJXK8LC', 'B004CQWWKY', 'B00F9VCQ2A', 'B00F75MX5I', 'B00E9GHR4S', 'B00JE48LUO', 'B00D0ONIJ8', 'B001LTZ7P2', 'B006MSEOJ2', 'B0011865IQ', 'B00C78KS78', 'B001QVCWSK', 'B0017O19Q2', 'B00B2D0XMO', 'B000CDVYNW', 'B003P00OSK', 'B00CY0RR3C', 'B009AG26WA', 'B004748SUY', 'B0006HVAHE', 'B00EILQD4O', 'B0083R1EPM', 'B004LL7EBM', 'B00125PX9U', 'B0083TTBWS', 'B000ILHPVS', 'B00274TB0W'], 'bought_together': ['B00CXWOIBK']}",{'Grocery & Gourmet Food': 11064},[['Grocery & Gourmet Food']],48.09,&aacute;vitae
109392,B005Y10X9S,,"South Beach Diet Good To Go Cereal Bar, Peanut Butter, 5-Count (Pack of 8)",http://ecx.images-amazon.com/images/I/51GJ%2Blx5WzL._SX300_.jpg,"{'also_bought': ['B008RW7PDS', 'B009T4APH6', 'B00D6CMPFW', 'B00J4Z50N4', 'B00INK49BU', 'B00C878UL4', 'B00DILE51I', 'B004IS56Y0', 'B0047WFO2G', 'B00AMCHH6Q', 'B001E52Z58', 'B004KQHFXA', 'B00EZB63HY', 'B006BV8SQ0', 'B007TGMCLI', 'B00DPCTSS0', 'B00GLXKDPC', 'B0052456US', 'B00IO2RPEK', 'B00BPF4NEI', 'B005CT9S7U', 'B003GTOJ4K', 'B000CQE3IC', 'B00D1EZJWQ', 'B00EDHWBW6', 'B000LKX4ZC', 'B00C7DIHUI', 'B0076YVPLG', 'B00ISG6ZJI', 'B00295IEYI', 'B006BV8RGG', 'B00FJYU67E', 'B00EZBA8PM', 'B008YD8232', 'B00DF0KYYY', 'B002ULC2GM', 'B00BV4HEE4', 'B00503DOY6', 'B005VOOS3U', 'B004619PQE', 'B0019RLJV2', 'B008CFOE66', 'B009XRM1QC', 'B00JD8W0LW', 'B00CL52KQY', 'B00FYR5HS4', 'B00EAMTSX4', 'B00FNNS98E', 'B000K7382A', 'B00IVT3LVM', 'B004S0DZ8W', 'B003XN0NZ8', 'B005VOOOM0', 'B00DF0NFJA', 'B00BGN8PL6', 'B008KYY96E', 'B00JD9WTLM', 'B00KCJR890', 'B004CWL0QK', 'B005TM2PZC', 'B00HG699OO', 'B008VQ1Q9O', 'B008N2XFC2', 'B009G4C0FY', 'B007P62TBK', 'B0000531B7', 'B000R8Y920', 'B008JA7CRW', 'B002E0S4UW', 'B00C7DIJFQ', 'B009C8I33M', 'B0086UI3RI', 'B001D3LUKW', 'B003RWVFEI', 'B00B22BCK2', 'B00JD76P5A', 'B000E1FZ28', 'B00JFNQKK2', 'B009EQ3MBK', 'B000E4C2MQ', 'B000EC63PU', 'B005ER1GPC', 'B007O044XI', 'B00B2JUCY2', 'B003EGSBI0', 'B00L7UBM68', 'B001993UR6', 'B004BKHX0U', 'B00D2PAI7K', 'B001DR488E', 'B004HO6I4M', 'B000WN594W', 'B007O04622', 'B004YHKVCM', 'B008IY5DIE', 'B002VUAM4G', 'B00ASBOP9S', 'B000CRKOIE'], 'also_viewed': ['B008RW7PDS', 'B009T4APH6', 'B00D6CMPFW', 'B00C878UL4', 'B000K7382A', 'B00EZB63HY', 'B007QZXFCM', 'B00F4BJTKM', 'B000K74S6U', 'B00AMCHH6Q', 'B006BV8RGG', 'B007TGMCLI', 'B00INK49BU', 'B00EZBA8PM', 'B006BV8KZO', 'B00EZC766A', 'B00K281HMU', 'B00EZBZ5OG', 'B00D1EZJWQ', 'B006BV8K86', 'B006BV8S7E', 'B00HSALXI8', 'B00INK49NI', 'B00KM2ZCMW', 'B00D1FAY2A', 'B00GH7FQGS', 'B008TSQEVE', 'B00E3QNFHW', 'B00J4Z50N4', 'B00KMPJE96', 'B006BV8SQ0', 'B000CQE3IC', 'B00K281G9E', 'B00503DOWS', 'B00EEJH2RW', 'B000FCIMUI', 'B00FNNS98E', 'B00503DP0O', 'B00G4EN2II', 'B0094GAJ5M', 'B0012KH0F0', 'B003XDZ65U', 'B00HSAW634', 'B006CGT7LY', 'B002NGQGTI', 'B0046HJN5G', 'B003AYF3IM', 'B00295IEYI', 'B00DILCU92', 'B000E8WIAS', 'B00APTHUEK', 'B004OCEO6Q', 'B0016BS38I', 'B00AYRJYGU', 'B00503DOY6'], 'bought_together': ['B008RW7PDS', 'B009T4APH6']}",{},[['Grocery & Gourmet Food']],40.99,South Beach Diet
113391,B006MONQMC,"Give me a ""C"" an Energy C, that is. Rah-rah for this dose of sunshine, bursting with its delicious thirst-quenching combination of tropical fruit punches. You&#x2019;re back in the game, my friend, and have an extra dose of vigor. Didn&#x2019;t Mom always tell you to add more vitamins to your diet? Thanks to Energy C, it&#x2019;s all in there with just one squeeze of the bottle  no nagging involved. Cue the cute cheerleaders. Rev up the feel-good music. Now you ""c"" what we&#x2019;re talking about? It&#x2019;s Energy C time.  A squeeze is all you need.","Vitamin Squeeze Energy Drink, Fruit Punch, 12-Ounce (Pack of 4)",http://ecx.images-amazon.com/images/I/41G1xCP807L._SY300_.jpg,"{'also_viewed': ['B00C1LXBFC', 'B00E0L4GS2', 'B00EUQK7OY', 'B00BBJTBE0', 'B00E9GHR4S', 'B00D9K57G0']}",{'Grocery & Gourmet Food': 148310},[['Grocery & Gourmet Food']],,
117740,B007B9WAH4,"Lipton To Go Stix Decaf Iced Green Tea Mix, Tea and Honey, Strawberry Acai, 10-Count","Lipton To Go Stix Decaf Iced Green Tea Mix, Tea and Honey, Strawberry Acai, 10-Count",http://ecx.images-amazon.com/images/I/51dLi9EDHVL._SY300_.jpg,"{'also_bought': ['B00FOMDTDO', 'B007P5PBLQ', 'B007P5NVBI', 'B00FOMDJCK', 'B00FOMDM2C', 'B00FOMDQTG', 'B00FOMDXXA', 'B00FOMDD1C', 'B00FOMCMMS', 'B00FOMCJ62', 'B007QH7JKE', 'B00FOMDOKW', 'B00FOMBAXK', 'B007XFFPM8', 'B00GLP9QS0', 'B00CX6Q3Z0', 'B00FOMCPSO', 'B00GLP9JI2', 'B007XFFOTW', 'B007QH41OG', 'B00GLP9JB4', 'B001THPU9E', 'B006MSEOJ2', 'B001THRQN2', 'B004EK0RJG', 'B005DM3N2M', 'B00JWXMYUU', 'B001THXOM4', 'B0005XOPFI', 'B00BI7Z0UE', 'B000V2ACTG', 'B007XFFP8C', 'B000KOWAPY', 'B007QH12Q6', 'B008O2TONK', 'B0014EUA1U', 'B008XV6WTG', 'B00FOMCFXO', 'B00AYCXLX2', 'B00294TUQA', 'B004S6BX26', 'B00BT2C1LY', 'B00BXGB4FK', 'B00CSKUJ8S', 'B005NCIJV2', 'B003WEFQ3W', 'B00AX2ELFU', 'B00H1BOMXM', 'B00294Z8MA', 'B00B7B8R38', 'B008UQVEQU', 'B004P7T7ZS', 'B0052LZ6XI', 'B005KK56JU', 'B00973WW8O', 'B00J9TD1AO', 'B005CT9S7U', 'B000F8EUR6', 'B0035N3ADS', 'B00CRAQHBW', 'B001T8MDFW', 'B00437I580', 'B00AYCXL4G', 'B0035N3AK6', 'B0076YVPLG', 'B008VSWSDU', 'B001KYQRWA', 'B004WN7DNS', 'B0014EOUAW', 'B000G7VZ7Y', 'B007M832Y4', 'B00CHHK4BE', 'B004P7V8Q4', 'B004P7QDLY', 'B00J5AZQF0', 'B00CSBXP92', 'B003P02EGU', 'B00DY01GOM', 'B004P6ITR6', 'B001THPU76', 'B000VM7HFS', 'B00GLP9PY0', 'B003GBEZBA', 'B007JFXXJY', 'B000LKXCB8', 'B003RWVFEI', 'B00BLCSKH6', 'B008JA7CRW', 'B003YZOGO4'], 'also_viewed': ['B00FOMDJCK', 'B00FOMDTDO', 'B00FOMDM2C', 'B00FOMCMMS', 'B00FOMDXXA', 'B007P5PBLQ', 'B00FOMDD1C', 'B00FOMCJ62', 'B007P5NVBI', 'B00FOMDOKW', 'B00FOMDQTG', 'B00FOMBAXK', 'B007QH7JKE', 'B00FOMCPSO', 'B00GLP9JI2', 'B00FOMCFXO', 'B00GLP9QS0', 'B00CX6Q3Z0', 'B00GLP9JB4', 'B007QH41OG', 'B00H1BOMXM', 'B00JXV2OJ2', 'B001THPU9E', 'B000HBO134', 'B00IP1XSFK', 'B001THRQN2', 'B007QH12Q6', 'B0034KQPKM', 'B007XFFPM8', 'B001EQ4DG6', 'B00294TUQA', 'B000HBIHPM', 'B001THXOM4', 'B005CT9OBK', 'B00CHI0SKU', 'B00J9TD1AO', 'B005LURCNW', 'B005LURCGO', 'B00J6HNI98', 'B0089C7HMU', 'B003X3G3AM', 'B004FQYYFM', 'B004M8PZ9W', 'B0040Q10TA', 'B002HQGFJK', 'B001R3BQC0', 'B004M8MI06', 'B00286KM2A', 'B00ICT3ERC'], 'bought_together': ['B007P5PBLQ', 'B007P5NVBI']}",{'Grocery & Gourmet Food': 230442},[['Grocery & Gourmet Food']],7.95,
118486,B007FK3CVM,"Aloe Vera contains more than 200 biologically active amino acids, vitamins, antioxidants, enzymes and minerals that have been clinically proven to improve skin and cardiovascular health. Our certified organic Aloe Vera is delicately processed to retain the bioactive component of Aloe Vera responsible for promoting healthy skin, a healthy digestive system and a strengthened immune system.","ALOE GLOE Natural Aloe Water, White Grape Pulp Free, 15.2-Ounce (Pack of 12)",http://ecx.images-amazon.com/images/I/412d6I5XpgL._SY300_.jpg,"{'also_bought': ['B001LTZ7P2', 'B000LL0R8I', 'B000CN7BMA', 'B008YDK8SO', 'B008N1NVP4', 'B005FC6T08', 'B0040PUEM0', 'B00FGQUFJY', 'B008N1NVTA', 'B0088MXS6U', 'B004748F2A', 'B00401P0IC', 'B003GADBYS', 'B0098EZJDW', 'B005HG9ET0', 'B001RN2VQU', 'B001N0TPVQ', 'B003P02EGU', 'B0072CRIR2', 'B000E4C2PS', 'B0098IMTIG', 'B001HTE5L8', 'B0017T6S2W', 'B000FVXNX0', 'B004CQWWKY', 'B003V8SO10', 'B004OVWQDA', 'B008EIY0F6', 'B008UQLZ5A', 'B008JKU2CO', 'B001HTR2E0', 'B004IN4L9G', 'B0033TYF2E', 'B002LL7OXM', 'B007PE7ANY', 'B001CGX3ZK'], 'also_viewed': ['B001LTZ7P2', 'B0040PUEM0', 'B001RN8H1S', 'B008N1NVP4', 'B008CIVZOM', 'B00F94XVVW', 'B005SY51TI', 'B007NHC0JM', 'B001AQW75Y', 'B007NHC2UO', 'B00HFKAAFI', 'B008N1NVTA', 'B008YDK8SO', 'B001LO34ZM', 'B00014EWUO', 'B001GBIOKK', 'B0082C11T2', 'B00FHMSHX8', 'B005H3AWNU', 'B0001VKEBS', 'B000QV9TA0', 'B00CNVKDU6', 'B00H76FNDO', 'B005P0N6YW', 'B005QUDIZI', 'B00HZ30I16', 'B00HBH011S', 'B005M48D26', 'B002COGR0Y', 'B0045TMJYC', 'B00H713UM0', 'B000GA95TQ', 'B00BVA6Q0G', 'B000LL0R8I', 'B002HZEDY0', 'B00J1R4L5S', 'B0055SYDQE', 'B00HKIBN7E', 'B005FC6T08', 'B0088MXS6U', 'B000CN7BMA', 'B00BV9OT6K', 'B000SAUI4U', 'B00B7V5Z7E', 'B00EFOS29S', 'B003V8SO10', 'B007ZN5K3M', 'B0040PUPRE', 'B00117CG30', 'B00772AQD0', 'B004OVWQDA', 'B005QUDJJ8', 'B003GADBSE'], 'bought_together': ['B001LTZ7P2', 'B000LL0R8I']}",{'Grocery & Gourmet Food': 10261},[['Grocery & Gourmet Food']],27.42,ALOE gLOE
119407,B007JFXWRC,,"Lipton Herbal Pyramid Tea Bags, Blackberry Vanilla, 18Count (Pack of 6)",http://ecx.images-amazon.com/images/I/51zfFh2CrDL._SY300_.jpg,"{'also_bought': ['B002HQGFJK', 'B00CHI18EK', 'B00CL6G7S0', 'B00CHHKCL6', 'B00CRAQB7C', 'B00CHHKDII', 'B00CHHKBLM', 'B00CHHK55O', 'B003VCZQIA', 'B007JFXXJY', 'B00CRAQHBW', 'B00CHI0SKU', 'B008YUL4KI', 'B002HQAYTM', 'B00CHHK4BE', 'B00CRAQF7S', 'B005CT9OBK', 'B00CO58H18', 'B007V2L8SS', 'B000HBMBYK', 'B007M8FRU6', 'B002YJCAKI', 'B00BJM7FFQ', 'B009L6Q2YW', 'B00568ARCC', 'B007M8FRV0', 'B00CQ7T34Y', 'B00EIB0T6W', 'B000GG0BNE', 'B000EM6PG2', 'B007V2L8TM', 'B003TBGMKE', 'B00DUQDIKU', 'B0042IMPTU', 'B007V2L8VK', 'B002YJCA30', 'B005Q8BIK2', 'B002JEYXSK', 'B00BY6NN30', 'B002YJCACG', 'B006W5WBUO', 'B000I4PY1S', 'B003D4IYYY', 'B002YJC990', 'B00FOMDM2C', 'B005CT9S7U', 'B00286KM8E', 'B0076OK56M', 'B00HSDRHTY', 'B00028MO04', 'B0073SQN9O', 'B00B2JUCY2', 'B00CREY86Y', 'B00DFX7782', 'B004GTAF2E', 'B00CQPVGN2', 'B00AK6PM3Y', 'B00AZIXZ6I', 'B00JFNQKK2', 'B003YNCIOG', 'B002SJUNU8', 'B000H7MFW2', 'B00G3KU0X8', 'B00CL52KQY', 'B002HQQZKO', 'B000Z3VUEC', 'B0057OR5IO', 'B008N2XFC2', 'B004ZG4DLM', 'B000E63L8S', 'B000EOXQRG', 'B001Z2TTMM', 'B0005XOPFI', 'B00CREXSHY', 'B004MYPVBI', 'B003K8299Y', 'B0062Q5V32', 'B002MTUD1S', 'B001Z2O0T4', 'B003D4F2US', 'B0012KH0F0', 'B003R0LLIU', 'B000CQG87Q', 'B008ELO6KC', 'B0030LXA0I', 'B00DDMIXJC', 'B0046KO7JA', 'B004S0DZ8W', 'B001E52Z58', 'B004D235V2', 'B0001SVZGE', 'B0067Y5KWG', 'B00CCDHZUG', 'B000KKXULG', 'B000GRPXFY', 'B00B22BCJS', 'B0094FMHWQ', 'B00AWKQWI2'], 'also_viewed': ['B002HQGFJK', 'B00CHI18EK', 'B00CHHKCL6', 'B00CHHKDII', 'B00CL6G7S0', 'B00CRAQB7C', 'B00CHHKBLM', 'B003VCZQIA', 'B00CHHK55O', 'B008YUL4KI', 'B00CRAQHBW', 'B00CHI0SKU', 'B007JFXXJY', 'B002HQAYTM', 'B00028MO04', 'B000GG5PQ2', 'B00CO58H18', 'B000E682D2', 'B00GEG40KA', 'B00CQPVGN2', 'B000E63LME', 'B003UL8S32', 'B005Q8BIK2', 'B000CQID92', 'B007V2L8SS', 'B005Q8BL9A', 'B000S4DAF0', 'B007M8FRU6', 'B005CT9OBK', 'B00BJM7FFQ', 'B0000CELU7', 'B00CREY86Y', 'B005Q8BL6I', 'B002YJCAKI', 'B007V2L8TM', 'B00CHHK4BE', 'B009L6Q2YW', 'B001EQ4ORY', 'B0080WBAM2', 'B0024SDYLI', 'B000EM6PG2', 'B00286KM8E', 'B00D3HTX8W', 'B000FB1XGY', 'B0042IMPTU', 'B00EP6F6OK', 'B000GG0BNE', 'B004XN8RWI', 'B002YJCA30', 'B007M8FRV0', 'B0073SQN9O', 'B00568ARCC', 'B00DUQDIKU'], 'bought_together': ['B00CHI18EK', 'B002HQGFJK']}",{'Grocery & Gourmet Food': 92670},[['Grocery & Gourmet Food']],16.99,Lipton
119581,B007K5KAJY,"What to drink when you want to think. This non-carbonated alertness beverage comes in delicious Red Berries, Mandarin Orange, Strawberry Kiwi and Lemonade flavors. All-natural, 45 calories, 11g of sugar. It's official: Nawgan is One Brainy Beverage.","Nawgan Mandarin Orange, 11.5-Ounce (Pack of 24)",http://ecx.images-amazon.com/images/I/41eAkEUfTBL._SY300_.jpg,"{'also_bought': ['B00128DPT2', 'B00EKJBV8W', 'B00C685F1S', 'B00KHD5IHK', 'B001N0TPVQ', 'B00DYXI58O', 'B003UN41J0', 'B00EKJBUQU', 'B0088MXS6U', 'B00ER0N4ES', 'B003UNBPYY', 'B003IHO8LY', 'B00F0T6Q8Q', 'B004CQYODW', 'B0048IAH30', 'B001534R00', 'B009GX9TT0', 'B003IJVSXS', 'B0017T1LGU', 'B00BJHELTY', 'B0013OVVMI', 'B002W9BLYG', 'B00CE4CRG0', 'B0030GXSVE', 'B00BPF4NEI', 'B008S4VLFI', 'B001RYKA3U', 'B003VMUILA', 'B003VTG7RC'], 'also_viewed': ['B00DYXI58O', 'B00128DPT2', 'B00C685F1S', 'B001N0TPVQ', 'B00EKJBV8W', 'B008S4VLFI', 'B004CQYODW', 'B003UNBPYY', 'B004JO4EFU', 'B0017O3QIG', 'B00GQSXA8Y', 'B008S4VKRC', 'B00KHD5IHK', 'B007R8XGKE', 'B001534R00', 'B003IHO8LY', 'B003DH0F8Y', 'B00BOTYGBU', 'B00D4JYOWE', 'B002W9BLYG', 'B001ESE21K', 'B000LKTQAE', 'B00EKJBUQU', 'B0013OVVMI', 'B00FBNUTHK', 'B0088MXS6U', 'B00CE4CRG0', 'B003SBRQP0', 'B0086VSJ1C', 'B00A1CEMD8', 'B00125PX9U', 'B001RYKA3U', 'B0013OUJPS', 'B003IJVSXS', 'B003H2QFI4', 'B000CFT76G', 'B007TW2G8Q', 'B00HQ3GO1I', 'B0038NEOKS', 'B008JKUBZM', 'B003P02EGU', 'B0038B3AAK']}",{'Grocery & Gourmet Food': 178452},[['Grocery & Gourmet Food']],,
120079,B007N04AF6,,"Quaker Real Medleys Apple Walnut Oatmeal +, (Pack of 12)",http://ecx.images-amazon.com/images/I/51Hxz86U17L._SX300_.jpg,"{'also_bought': ['B00E77NXE2', 'B00GT0JWIG', 'B00DL75IB0', 'B00CS4TBS8', 'B00GT0M2TW', 'B00FLJCGD4', 'B00CVTFQT8', 'B000YPMKXQ', 'B002DHOWIY', 'B00437CBWG', 'B00FLJCGH0', 'B00CF59M0M', 'B000FFLTM8', 'B000FFPXJ8', 'B0072Z1ZNM', 'B001M09BOS', 'B004X8T920', 'B007G5C87K', 'B00G4BAKY0', 'B00EFQ41JG', 'B001IMWBII', 'B006H34CYO', 'B000V6L2FK', 'B001M09BUW', 'B0045E0CCI', 'B00I90LUNE', 'B005DVUTIO', 'B002DHSDW0', 'B00C8W0GUM', 'B000FFRU3U', 'B000CSEFQ0', 'B001651282', 'B000ITYSVK', 'B00IAEQNIG', 'B001V78QZW', 'B000V6FU08', 'B0083T34SU', 'B001G0NL18', 'B008XV6WTG', 'B0017U48KK', 'B001M0AL8I', 'B008JKU2CO', 'B0029TJTLG', 'B00BXGB4F0', 'B001BZ5FDU', 'B000FFPXF2', 'B00DGW4MEO', 'B0088W8HKC', 'B000FFPXKM', 'B000MDCDJ6', 'B0032ZB03G', 'B002DHSEKG', 'B000CS9ZWO', 'B00D3J98D0', 'B006NWITL6', 'B000ITVLE2', 'B00032C8T6', 'B001E52ZJ4', 'B003MZBPFY', 'B000LTM29M', 'B0081RNC4A', 'B00FYR5HS4', 'B000LKVB6Q', 'B005VOOOM0', 'B008JKUBZM', 'B0046HJN5G', 'B007WW5E8M', 'B0016COPU2', 'B000FFLTD2', 'B000FFIEL2', 'B001M0AK5M', 'B0028GY9J2', 'B007PE7ANY', 'B0029TAVKE', 'B0028667PG', 'B006P9XEW6', 'B00EHAYA78', 'B000FIXT2I', 'B000O9WEY2', 'B003ZXAN4C', 'B0076YVPLG', 'B0035YB868', 'B004YHKVCM', 'B004SPEM1G', 'B0058AMY5G', 'B00CVTFS5U', 'B003ZXEBOK', 'B000PG5ABI', 'B00A3Q3MK6', 'B003ZXCA2U', 'B004I05VDY', 'B004IRSSHI', 'B001V76MFS', 'B007UZNS5W', 'B0040WE8NE'], 'also_viewed': ['B00E77NXE2', 'B000YPMKXQ', 'B00GT0JWIG', 'B00DL75IB0', 'B00G4BAKY0', 'B00AOP1RM6', 'B00GT0M2TW', 'B006CFVC72', 'B000FFLTM8', 'B00FLJCGD4', 'B000FFPXJ8', 'B0072Z1ZNM', 'B00CS4TBS8', 'B000HIFB8Q', 'B00CF59M0M', 'B00E3KNVY0', 'B00CVTFQT8', 'B00I90LUNE', 'B00FYJJ85K', 'B00AOP1NFW', 'B000O9WEY2', 'B0083T34SU', 'B00HQT5CJ2', 'B00FMFCJUW', 'B00C8W0GUM', 'B000HIHEL8', 'B001M09ATY', 'B00D3HURTG', 'B00IIZP7L6', 'B004X8T920', 'B000FFRU3U', 'B001M09BOS', 'B00F9XT6L2', 'B005AZ5Q0E', 'B00FLJCGH0', 'B001M09BHU', 'B001T8MDFW', 'B005MWANZ8', 'B00HQT5AHQ', 'B00L3MMR32', 'B002DHKUWQ', 'B00CEML9UW', 'B001M09BUW', 'B000FFPXKM', 'B00EFQ41JG', 'B001M0AL8I', 'B00FYJNA3G', 'B00IIZPFZY', 'B001M0AK5M', 'B00EJQ9QWE', 'B001M0AKWA', 'B005AZ4MP4', 'B007G5C87K', 'B00HXXOJU4', 'B002DHOWIY', 'B00AHRBXLQ', 'B00746MM68'], 'bought_together': ['B00E77NXE2']}",{'Grocery & Gourmet Food': 5077},[['Grocery & Gourmet Food']],29.35,Quaker
124752,B0084ZZ5PI,,"V-8 Energy Shot, 2.5-Ounce Bottles (Pack of 12)",http://ecx.images-amazon.com/images/I/41CpYTBeGQL._SY300_.jpg,{'also_viewed': ['B008JA7CRW']},{'Grocery & Gourmet Food': 224248},[['Grocery & Gourmet Food']],,
