,productID,description,title,imUrl,related,salesRank,categories,price,brand
6096,B0004MTMD0,"The dried peel of California lemons adds zesty lemon flavor to desserts, marinades and seafood. Use as a one-for-one substitution in recipes calling for fresh lemon peel.","McCormick Gourmet Collection Lemon Peel, 1.5 Ounce Unit",http://ecx.images-amazon.com/images/I/41hjbWJIyaL._SY300_.jpg,"{'also_bought': ['B00B4IG3GM', 'B0005XN9KK', 'B000WR2OFK', 'B0012BS9F4', 'B000WR4LM4', 'B004LVYQ9K', 'B000WS1KOA', 'B00269PM6K', 'B0044KNPKO', 'B000WS3APW', 'B000WS1KI6', 'B000WS3AMU', 'B000WS08YI', 'B000WS3AJS', 'B0053OF9HW', 'B007YXV172', 'B0001M10N8', 'B000B6J55Y', 'B0001M10LU', 'B00AKPO042', 'B001PQMJD4', 'B000WR8LWA', 'B000WR8TYK', 'B00269XE0Q', 'B005MIWPGC', 'B0050IKSBI', 'B00AJRKQDU', 'B00AJRKO8M', 'B001NH8RQS', 'B0040MM7C8', 'B00269T9JQ', 'B001PQREKM', 'B0048B35HM', 'B001PQOAOA', 'B00A6QETEQ', 'B00AJRKMNE', 'B007FA1EBW', 'B006NIPC5Q', 'B001PQMJIY', 'B00AJRKITM', 'B0055VLVO8', 'B000WR8TT0', 'B00C1EYGW6', 'B00EYA0TXK', 'B008XJAP8C', 'B0005YLYDS', 'B009RS1ILG', 'B008OGCWZI', 'B000WS1DT2', 'B0032GREV2', 'B007YYD31I', 'B005EOTMA6', 'B00A38195Y', 'B00016XLEA', 'B00269YPBS', 'B0056GRU1U', 'B001PQOAP4', 'B008OGCCLC', 'B00AJRKHZC', 'B000WR4SJ0', 'B005CUM0J2', 'B00269YPB8', 'B000ZNOVCA', 'B008OGCQYK', 'B00474HER2', 'B000NO943C', 'B00A381JOA', 'B0012690UC', 'B0045DMLXM', 'B000RNCKQ2', 'B006AXEO0S', 'B0029K18XM', 'B000WS1KHM', 'B00004RFPY', 'B00A3811YS', 'B002HMN6SC', 'B006QYNLKU', 'B004LAZ8SO', 'B0029JXNDG', 'B00BMJR07Y', 'B003CIHTBU', 'B00085F7VO', 'B008OGCZPA', 'B003TRL87U', 'B0001M10VA', 'B000M1HQFY', 'B0001CXUHW', 'B00AZX0IE0', 'B005F25FIU', 'B0044R1HAM', 'B002YI20NG', 'B000ZNTPTE', 'B000EWMJ8U', 'B005EKI0FS', 'B000WR4SGI', 'B005GWV7SG', 'B004G7PLJI'], 'also_viewed': ['B00B4IG3GM', 'B007YXV172', 'B0001M10VA', 'B005D8T86G', 'B000WR4LM4', 'B000B6MW3Q', 'B00A3811YS', 'B004I3ZQRM', 'B0005XN9KK', 'B007PPUZTY', 'B0000CNU1S', 'B00A0ACZVC', 'B00A37ZUV4', 'B00017P2M8', 'B001RV8CHY', 'B004OKTBVQ', 'B00AJRKITM', 'B0005XNA18', 'B00BHS9HO4', 'B00BEQO67M', 'B0001M10LU', 'B002YH0106', 'B00AVIUEH0', 'B00A8O5CN8', 'B008MM9W3E', 'B007P4X380', 'B004AFM7P2', 'B000WR2OFK', 'B001PQMJD4', 'B000WS3AJS', 'B005CSKUP0', 'B00AKPO042', 'B000WR2F0Y', 'B000WR4SGI', 'B0001M0YK8', 'B000N8CXQS', 'B0095FATRK', 'B00EFIPV0C', 'B00269PM6K', 'B0044KNPKO', 'B003CIHTBU', 'B007P4W0OI', 'B000RHUVSM', 'B008OGCH80', 'B00AOATAHA', 'B00A381VFC', 'B00AJRKO8M', 'B006R0LE5W', 'B000WS1KI6', 'B000WR2MP2', 'B0012BS9F4', 'B000UYFLL4', 'B00B0Q9PX6', 'B007PTHZBG', 'B000WS3APW', 'B004LVVM2E', 'B008AMRLDY', 'B00CK03TOM'], 'bought_together': ['B00B4IG3GM']}",{'Grocery & Gourmet Food': 14120},[['Grocery & Gourmet Food']],12.05,McCormick
8575,B00099XMX4,,"Progresso Traditional Soup, Homestyle Chicken, 19-Ounce Cans (Pack of 6)",http://ecx.images-amazon.com/images/I/51X1GqwUyNL._SY300_.jpg,"{'also_bought': ['B00434J5IW', 'B001BZBS1S', 'B005EKIAZI', 'B00434KOPK', 'B0014EW4N2', 'B0014EOUYI', 'B0029TJTQG', 'B0040PYG9W', 'B005VBD46U', 'B001BCVDXO', 'B0014EQIFM', 'B0019RLJV2', 'B004WN7DNS', 'B0014EOVI8', 'B00FQGP20Q', 'B001SEL4HK', 'B0014EW3ME', 'B002XPPAA0', 'B007UZNS5W', 'B000V6L2FK', 'B001UQ2SH6', 'B005EKIBX4', 'B003XUJ564', 'B0009XQSAY', 'B00L1KPV7U', 'B007S8759G', 'B00D0756AO', 'B00CI3ULWO', 'B006JW4TNM', 'B0014GRP7A', 'B004GH8IJ8', 'B0032GRFD4', 'B00KYW1K26', 'B0040PUGZ0', 'B005VBD4BA', 'B0040PSSYG', 'B00374Y7C8', 'B001E52Z58', 'B001SAY7BO', 'B005DVUVFA', 'B0025UCIPS', 'B00DBSFXUK', 'B005CT9S7U', 'B003VZCYHI', 'B006JW4TLY', 'B0036VLZS6', 'B009CWMO7O', 'B00437I580', 'B00E3A1Q9W', 'B005EKI710', 'B006JW5166', 'B00B59QDLK', 'B004AE1FHY', 'B00B90LCJ8', 'B001IH8ERA', 'B003CN34VO', 'B005EKI2YW', 'B0012271RA', 'B000MIDROQ', 'B00BGN8PLG', 'B001E52WAG', 'B007J7BSYE', 'B0029TJTH0', 'B001M0AL8I', 'B006W5WAL4', 'B00421DMLM', 'B00JAQROMM', 'B004CYJXQW', 'B0010VUG0C', 'B001CWV4PA', 'B00374WK4U', 'B002AQP5MK', 'B0005YLN0W', 'B006VS065O', 'B0044R3DNG', 'B0036VLZNG', 'B00374W630', 'B004YPJKBC', 'B008XV6WTG', 'B005DVUTIO', 'B005DDC3JK', 'B0044CJDTO', 'B0082N3SHE', 'B006GXQHKW', 'B005EKICBK', 'B005EX6N2M', 'B001E55YXS', 'B003P7ZMXA', 'B00HFQ2T06', 'B00434J6MM', 'B00DBSFXUA', 'B009EQ3MBK', 'B002UMCSY2'], 'also_viewed': ['B00434J5IW', 'B001BZBS1S', 'B005EKIAZI', 'B00434KOPK', 'B0014EOUYI', 'B00B1XCSAK', 'B0029TJTQG', 'B0014EQIFM', 'B005VBD46U', 'B0014EOVI8', 'B001SAQ7WQ', 'B0036VLZNG', 'B0014EW4N2', 'B0029JZEJM', 'B0029TJTLG', 'B000V6L2FK', 'B000HD3YDU', 'B005VBD4BA', 'B0040PYG9W', 'B0014EW3ME', 'B00B7B8R38', 'B005DVUVFA', 'B003XUJ564', 'B0029TAVKE', 'B006JW4XT2', 'B004WN7DNS', 'B000G1EO4G', 'B005VBD5UU', 'B00GAQ2Z38', 'B005EKIDG4', 'B000ELWDQY', 'B005DVUX08', 'B000KABMUC', 'B0052HX9JA', 'B000MIDROQ', 'B00JMG50XK', 'B000FFRTVI', 'B000EOXQRG', 'B001IH8ERA', 'B000FFPXF2', 'B0040PUGZ0'], 'bought_together': ['B00434J5IW', 'B001BZBS1S']}",{'Grocery & Gourmet Food': 51131},[['Grocery & Gourmet Food']],27.9,Progresso
10987,B000E1BL5S,"Planters began as a vision in the mind of a young Italian immigrant named Amedeo Obici. Little did he know that the small business he began in 1906 would grow into the world's grandest nut company.Planters ad, 1949Obici, along with his friend and business partner Mario Peruzzi, founded Planters Peanut Company in Wilkes-Barre, Penn., in 1906. Seven years later, Obici built his first processing plant in Suffolk, Virginia. Mr. Peanut didn't come along until 1916, when a schoolboy named Antonio Gentile submitted his sketch to win a Planters contest for a brand icon. A commercial artist later added a top hat, monocle, and cane. The company's first ad, appearing in the Saturday Evening Post in 1918, was also the first for a salted nut. The hugely popular dry-roasted version of Planters peanuts made its debut in 1962. Later introductions have included unsalted and roasted peanuts, Planters Trail Mix, Honey-Roasted Peanuts and Cashew Mix, and more recently, NUTrition. For more than 100 years, Planters has built a reputation and a powerful brand by offering superior quality and product innovation.Planters is a member of the Kraft family of brands.About KraftKraft has come a long way since 29-year-old James L. Kraft moved from Ontario, canada, to Chicago and started selling cheese to grocers from a horse-drawn wagon. In fact, the story dates back further, since for more than 200 years, many companies have united to make Kraft Foods what it is today. It started before the Revolution--in Dorchester, Massachusetts--when, in 1765, a local physician, Dr. James Baker, went into partnership with a young Irish chocolate-maker, John Hannon. It was America's first chocolate mill, where, in 1780, they made a blend of quality chocolate called Baker's chocolate. Baker's chocolate was the first of a long list of companies that have joined Kraft Foods, Inc., in making good food for busy families.In 1988, Kraft became part of Philip Morris Companies Inc., and a year later Philip Morris Companies combined Kraft and General Foods Corp. to form Kraft General Foods, the largest food company in the U.S. Some of the most popular and well-known brands in the Kraft family include Maxwell House, Yuban, Oscar Mayer, Breakstone, Grape-Nuts, Jell-O, Post, Minute Rice, Cheez Whiz, Cracker Barrell, Tang, Cool Whip, Shake 'N Bake, Stove Top, General Foods International Coffees, and many, many more.","Planters Trail Mix, Sweet &amp; Nutty, 6-Ounce Bags (Pack of 12)",http://ecx.images-amazon.com/images/I/51EV8cdufwL._SY300_.jpg,"{'also_bought': ['B0032ZB03G', 'B001V78QZW', 'B0045E0CCI', 'B000LTIDR2', 'B001GSB5EA', 'B003ZXEBOK', 'B0088W8HKC', 'B008XV6WTG', 'B004IRSSHI', 'B000PG8KGU', 'B001V76MFS', 'B003AM1FTA', 'B00AX0CYWE', 'B00EDMDOFO', 'B000LUC48K', 'B000G7VYWA', 'B000LTM29M', 'B005CT9S7U', 'B003MZBPFY', 'B000PG5ABI', 'B0042DIZIU', 'B001IMUHCU', 'B009PIORKC', 'B00DGW4MEO', 'B0028GY9J2', 'B0046HJN5G', 'B00B42DBRC', 'B002AH0LJG', 'B001PAS5GK', 'B004OT9522', 'B000JZ5CQS', 'B00FYR5HS4', 'B005GS4FYI', 'B00408268C', 'B001V76MGC', 'B0029JXEM6', 'B003LPKFMO', 'B0001WV0TW', 'B00IE68JL4', 'B00A2SSPB6', 'B003LPMAUO', 'B001RVFDOO', 'B00158Q2OY', 'B000CQE3IC', 'B00HFVVEPW', 'B000PWYIOW', 'B0015OMKVM', 'B0006SW71G', 'B008500J8K', 'B000I1T368', 'B000EMK4CS', 'B00AJXRRK4', 'B000FOIYS6', 'B00F6MFXCW', 'B001444G5Q', 'B005VOOOM0', 'B006YDER38', 'B007PE7ANY', 'B003X7R8NY', 'B0017KYJK4', 'B008JKU2CO', 'B001G8UCRQ', 'B000P6MSOU', 'B0015358Q2', 'B00CQ77UNA', 'B004URPYHS', 'B001FA1DYG', 'B00BV283BO', 'B007JG0XMI', 'B0017KYJD6', 'B003ZXAN4C', 'B00BJM66RO', 'B0057RDATY', 'B000YT5PPM', 'B001HXJP2S', 'B003BGBVQ2', 'B006C52SGG', 'B008QZZ88K', 'B00CWYM3OI', 'B000FF9DV2', 'B003ZXCA2U', 'B000O9WEY2', 'B000JIN1H2', 'B0016P26CS', 'B000WL39JQ', 'B0017KWNZC', 'B007WW5E8M', 'B001942GAI', 'B00C6VNWTC', 'B008MURM3I', 'B00149FT0M', 'B004IS56Y0', 'B001E6GFR6', 'B001EO6BCC', 'B001FSISY6', 'B0058AMY5G', 'B001IZEJ76', 'B00F9WHEQM', 'B0058AMZN2', 'B0041BSZGA'], 'also_viewed': ['B000PG8KGU', 'B005CT9S7U', 'B002ULC2GM', 'B001E52Z58', 'B001GSB5EA', 'B0015OMKVM', 'B000PG5ABI', 'B00FN6F15A', 'B003AM1FTA', 'B0032ZB03G', 'B00JUYTWTC', 'B001V78QZW', 'B00149FT0M', 'B0017KWNZC', 'B0045E0CCI', 'B0017L3MRE', 'B004IO5XWE', 'B002ULINVU', 'B001651228', 'B001GSFDIO', 'B00ARINPNY', 'B00B42DBRC', 'B0017DGR1U', 'B00ARJOVV8', 'B00ARISFEI', 'B008XV6WTG', 'B000LTIDR2', 'B00CPS6VTO', 'B00IIJSY6M', 'B00CBG7DMY', 'B003ZXAN4C', 'B004IRSSHI', 'B001PAS5GK', 'B000P6MSOU', 'B004IO5374', 'B000V96C4I', 'B0088W8HKC', 'B006YDER38', 'B00158Q2OY', 'B008GV98FI', 'B001V76MFS', 'B005RFFWBA', 'B00LZCPA5M', 'B00IA82W6E', 'B00HVLCQ9E', 'B008500J8K', 'B00IE68JL4', 'B003ZXEBOK', 'B003LPMAUO', 'B0043H4S5E', 'B001IMUHCU', 'B00KB9KWMG', 'B000LTM29M'], 'bought_together': ['B0045E0CCI', 'B0088W8HKC']}",{'Grocery & Gourmet Food': 96284},[['Grocery & Gourmet Food']],34.35,Planters
11164,B000E1HUVC,"Planters began as a vision in the mind of a young Italian immigrant named Amedeo Obici. Little did he know that the small business he began in 1906 would grow into the world's grandest nut company.Planters ad, 1949Obici, along with his friend and business partner Mario Peruzzi, founded Planters Peanut Company in Wilkes-Barre, Penn., in 1906. Seven years later, Obici built his first processing plant in Suffolk, Virginia. Mr. Peanut didn't come along until 1916, when a schoolboy named Antonio Gentile submitted his sketch to win a Planters contest for a brand icon. A commercial artist later added a top hat, monocle, and cane. The company's first ad, appearing in the Saturday Evening Post in 1918, was also the first for a salted nut. The hugely popular dry-roasted version of Planters peanuts made its debut in 1962. Later introductions have included unsalted and roasted peanuts, Planters Trail Mix, Honey-Roasted Peanuts and Cashew Mix, and more recently, NUTrition. For more than 100 years, Planters has built a reputation and a powerful brand by offering superior quality and product innovation.Planters is a member of the Kraft family of brands.About KraftKraft has come a long way since 29-year-old James L. Kraft moved from Ontario, canada, to Chicago and started selling cheese to grocers from a horse-drawn wagon. In fact, the story dates back further, since for more than 200 years, many companies have united to make Kraft Foods what it is today. It started before the Revolution--in Dorchester, Massachusetts--when, in 1765, a local physician, Dr. James Baker, went into partnership with a young Irish chocolate-maker, John Hannon. It was America's first chocolate mill, where, in 1780, they made a blend of quality chocolate called Baker's chocolate. Baker's chocolate was the first of a long list of companies that have joined Kraft Foods, Inc., in making good food for busy families.In 1988, Kraft became part of Philip Morris Companies Inc., and a year later Philip Morris Companies combined Kraft and General Foods Corp. to form Kraft General Foods, the largest food company in the U.S. Some of the most popular and well-known brands in the Kraft family include Maxwell House, Yuban, Oscar Mayer, Breakstone, Grape-Nuts, Jell-O, Post, Minute Rice, Cheez Whiz, Cracker Barrell, Tang, Cool Whip, Shake 'N Bake, Stove Top, General Foods International Coffees, and many, many more.","Planters Cashews in Milk Chocolate, 3.5-Ounce Pouches (Pack of 12)",http://ecx.images-amazon.com/images/I/512dCLVgB2L._SY300_.jpg,"{'also_bought': ['B002ULC2GM', 'B001E52Z58', 'B003P7ZMXA', 'B003P7XXPE', 'B00509LVIQ', 'B0057XBCWA', 'B005VOOOM0', 'B00B044BNW', 'B007UZNS5W', 'B004S0DZ8W', 'B00DE4I5CE', 'B003RWVFEI', 'B00DBSFXUA', 'B007PE7ANY', 'B001E53WBE', 'B006W5WBUO', 'B001651282', 'B008JKU2CO', 'B0042DIZIU', 'B00KYW1K26', 'B004B9T82W', 'B008JBDMO8', 'B008XV6WTG', 'B000CQE3IC', 'B003P02EGU', 'B001E53020', 'B002OG1NUO', 'B00C3YAEY8', 'B003ZA1HKY', 'B005VBD46U', 'B0062Q5V32', 'B009EQ3MBK', 'B006W5WAL4', 'B003ZXEBOK', 'B008ELO6KC', 'B004NCGFIC', 'B003XV1T6C', 'B0052456US', 'B004UKJS68', 'B004E94O32', 'B00DQTBZCO', 'B00DILCU92', 'B00JD9XUEW', 'B005EKIFDK', 'B008KAM0XM', 'B00HFQ2T06', 'B00L1KPV7U', 'B004YHKVCM', 'B004HFPNT2', 'B001EO7LVM', 'B00DF0KXYK', 'B00351ZA1A', 'B005G2FCI2', 'B00CI3ULUG', 'B005MWLOE2', 'B000LKXCD6', 'B0081Q1NKG', 'B007RGB2E8', 'B003VMW0KC', 'B007Z48F56', 'B007POA19O', 'B00374WK4U', 'B004T8WDMW', 'B008DQI0UK', 'B000ZL3OFW', 'B004VLVJB8', 'B00AOMO1CW', 'B002NGSIW6', 'B000EMK4CS', 'B00EDHWBW6', 'B0049M7LES', 'B0019RLJV2', 'B00F9VCQ2A', 'B002E0S4UW', 'B0074B4G3K', 'B001E6GFR6', 'B004OCEO6Q', 'B008UQVA9G', 'B00ASBOT2Q', 'B001HXJGKO', 'B00CLXHYZS', 'B004I05VDY', 'B00437I580', 'B00099XOVE', 'B0044CJDTO', 'B004GP618U', 'B000JMAVYO', 'B004D797DM', 'B000LL0R8I', 'B00ASBOP9S', 'B007VN10VW', 'B005ER16PW', 'B00CRCKDJC', 'B00269UWFG', 'B009M8VWT4', 'B008N2XFC2', 'B000H7LVKY', 'B005VBBSVI', 'B0049D7JQW', 'B001M0A8XQ'], 'also_viewed': ['B001E52Z58', 'B002ULC2GM', 'B001651282', 'B00BSW6I14', 'B002ULINVU', 'B00269UWFG', 'B00BNQGMFC', 'B001YJ6L2C', 'B00A9TRDWA', 'B001EQ5JNW', 'B003P7ZMXA', 'B00AY84BJO', 'B00ADX5WZ2', 'B003P7XXPE', 'B000CQE3IC', 'B004619PQE', 'B00A850UQ6', 'B004KQHFXA', 'B0051TPWG2', 'B0047WFO2G', 'B00ECQIKMS', 'B008KAM0XM', 'B00DE4I5CE', 'B005TM2PZC', 'B00C7DIJFQ', 'B00F99A2I2', 'B00IIJSY6M', 'B000PG5ABI', 'B0076YVPLG', 'B007T3N5TE', 'B001L7XU76', 'B00C7DIHUI', 'B00E1Z27LU', 'B005MWLOE2', 'B000N1XFB2', 'B0025XLX60', 'B00ECQIG3G', 'B00509LVIQ', 'B003RWVFEI', 'B007NHCQQE', 'B008114GDW', 'B00JSX1HMK', 'B00F999VXY', 'B002AWXELI', 'B00G6RK1NM', 'B00AJ38ANM', 'B0042DIZIU', 'B001PB3000', 'B0058EDEUG']}",,[['Grocery & Gourmet Food']],,
13810,B000F4DKAI,"Since 1706, Twinings has been at the forefront of the tea trade. Customers in more than 100 countries enjoy Twinings products, and not just the popular traditional favorites: Twinings now includes products such as fruit and herbal infusions, aromatic teas, and iced teas. These fresh flavors reflect a worldwide trend toward a healthier and more varied lifestyle. The new flavors are as successful as the traditional ones, because Twinings prepares them using skills acquired through three centuries of experience. After quenching thirsts for so many generations, no one knows better than Twinings how to deliver a drink that's in perfect condition. Although British-based, and still operating in England, Twinings also has plants in North Carolina and Calcutta, India. Success in the competitive worldwide tea market was confirmed in 1972 (and again in 1977) when Twinings became the first tea company to win a Queen's Award for Export.","Twinings English Afternoon Tea, Tea Bags, 20-Count, 1.41 oz. Boxes (Pack of 6)",http://ecx.images-amazon.com/images/I/51%2BwcsdrwGL._SX300_.jpg,"{'also_bought': ['B000F4F952', 'B000F4H5GI', 'B000S4DAF0', 'B000GG0BNE', 'B000F4H5G8', 'B000F4J75K', 'B004XGCXAC', 'B000F4DKBC', 'B001MOWL8M', 'B0019VLUHQ', 'B000F4DKA8', 'B0028GWGWO', 'B000CQG8K8', 'B000CQG87Q', 'B0046IEK7G', 'B000E682D2', 'B001MOQI0Y', 'B001MOP88W', 'B000GG0BPM', 'B009UQXD90', 'B003D4F2US', 'B00D5DVJ1S', 'B000CQE42M', 'B001M09BQQ', 'B0000CELU7', 'B000OQWAS0', 'B009L6Q2YW', 'B0009F3PM6', 'B000F4J72I', 'B004IRSSHI', 'B00C1C21I4', 'B002HQP4WO', 'B0045E0CCI', 'B005VBBSVI', 'B000NIFO96', 'B00L1KPV7U', 'B00HDTF5B0', 'B00HFQ2T06', 'B00451ZJB0', 'B0042DIZIU', 'B003LTOBAC', 'B007J82R8O', 'B001F51A58', 'B00DUQDIKU', 'B000E6LBXK', 'B00DOSANPW', 'B00C43H85G', 'B002HQCWYM', 'B0091DS0UY', 'B008JKUBZM', 'B004S0DZ8W', 'B008EIY0F6', 'B007PE7ANY', 'B00451SGZ6', 'B008YD8232', 'B007UZNS5W'], 'also_viewed': ['B0000CELU7', 'B000F4F952', 'B00BWW8VAQ', 'B000F4H5GI', 'B004E3EKD2', 'B004XGCXAC', 'B000S4DAF0', 'B001MOH3VW', 'B001MOP88W', 'B000FB1XGY', 'B000GG0BNE', 'B0005ZVPGS', 'B001MOWL8M', 'B005Q8BL9A', 'B001MOQI0Y', 'B0016G1DQW', 'B000FL9E4C', 'B000F4H5G8', 'B009LIK0FW', 'B0046IEK7G', 'B004AFKYDE', 'B009G1N8GC', 'B000S6CCJ8', 'B000F4DKA8', 'B00181U5A0', 'B001EQ4ORY', 'B004O6YYQ2', 'B003MZBX10', 'B000MNNELC', 'B003D4F2US', 'B001MOYIWY', 'B001EQ4MPI', 'B000F4DKBC', 'B003MZFCY4', 'B001MOJXME', 'B000FN4V1G', 'B000F4J72I', 'B005Q8BIAC', 'B0055BDVDC', 'B000E63LME', 'B005Q8BIK2', 'B009UQXD90', 'B000F4J75K', 'B004X9XU56', 'B0057PTXZG', 'B000E682D2', 'B009L47BR6', 'B002HQEQQ4', 'B004YADQZI', 'B002L68KDK', 'B004XN8RWI', 'B001GM60LE', 'B0028GWGWO', 'B002Q11DX4', 'B001MP3Q76', 'B0039ONBRI', 'B00GO47A4K', 'B00DMD9UJ4', 'B004OINZZQ'], 'bought_together': ['B000F4F952', 'B000GG0BNE']}",{'Grocery & Gourmet Food': 10436},[['Grocery & Gourmet Food']],26.27,Twinings
15269,B000FIXT2I,Fully Cooked Organic Brown Rice Bowl - ready in 90 seconds,"Steamed Brown Rice Bowl, Organic, Microwaveable, 7.4-Ounce Bowls (Pack of 12)",http://ecx.images-amazon.com/images/I/51cDmThXCVL._SX300_.jpg,"{'also_bought': ['B0083T34SU', 'B0007R9L4M', 'B003U97L1Y', 'B004PY66R8', 'B00BXGVA7C', 'B005J6AGKY', 'B000FFIEL2', 'B000ITVLE2', 'B003RWVFEI', 'B004BJWTBY', 'B001228Q5Q', 'B004PYF11U', 'B00GRT9PZY', 'B0043ZKZA8', 'B00374WK4U', 'B000FFPXF2', 'B004XUDWW6', 'B0031YIN7O', 'B000GPTC8U', 'B0025ULK66', 'B0017U7TFG', 'B000FFLTDM', 'B004YPJKBC', 'B006NWITL6', 'B0076YVPLG', 'B000PVX84E', 'B000ITYSVK', 'B008JKU2CO', 'B002JF62GU', 'B002JF61XO', 'B003NRMHFI', 'B00COACXMC', 'B000FFLTD2', 'B0043OY1HW', 'B003ESRF5I', 'B000FFRTVI', 'B000E5ILGQ', 'B0048KJ1BW', 'B000FIXYD2', 'B0017U24KG', 'B00153C4B4', 'B004BJS1PM', 'B009Z8OI6U', 'B00IO2RNAG', 'B0054TWPNC', 'B000V6FU08', 'B002BCE9JS', 'B0040PYG9W', 'B0009XQSAY', 'B000FFIEMQ', 'B000E158ES', 'B001E55YXS', 'B000E1FXQ6', 'B000LKVDUU', 'B000FK7G20', 'B000LL0R8I', 'B001BZ5FDU', 'B00JWXMYUU', 'B005OHBN1Y', 'B00B044BNW', 'B000FFPXJ8', 'B005FC75X8', 'B000LQNKAA', 'B000V6L2FK', 'B001SB8AZC', 'B000LKTW3K', 'B006045ONI', 'B0040WE8NE', 'B008IY8D6I', 'B00778B90S', 'B005CT8R90', 'B00D3J98D0', 'B0017U08M2', 'B00AKVU5CW', 'B000N8N45W', 'B000V1D19A', 'B000LQNK6E', 'B005EKI710', 'B006P9XEW6', 'B006JW5166', 'B0040Q0JWO', 'B000FFRTYK', 'B001E52Z58', 'B00AJ58FQM', 'B0054TWQ3Q', 'B001PICX42', 'B000LKZ86K', 'B0017U24LA', 'B003VMUILA', 'B003YBNKC2', 'B00DUQDIKU', 'B005VOOOM0', 'B004YHKVCM', 'B00E7OS8OA'], 'also_viewed': ['B005J6AGKY', 'B003U97L1Y', 'B004BJWTBY', 'B00BXGVA7C', 'B000GPTC8U', 'B0083T34SU', 'B004XUDWW6', 'B00IWK2B5C', 'B005NEDME4', 'B004BJS1PM', 'B005NECMX6', 'B00GX3I8XE', 'B004H4LMN4', 'B009Z8POFO', 'B009Z8OI6U', 'B008IY8D6I', 'B004NRHAZO', 'B005763JMI', 'B004PY66R8', 'B00GRT9PZY', 'B0007R9L4M', 'B001228Q5Q', 'B005763K40', 'B000FFIEL2', 'B0031YIN7O', 'B00L3Q6IQK', 'B00FJ2AAR2', 'B00KW0PA9O', 'B000G82L62', 'B000FFLTD2', 'B00E7OS8OA', 'B001HTIXPC', 'B000643THQ', 'B000KOSMWE', 'B00D2S52XM', 'B000ITVLE2', 'B000FFPXF2', 'B000EGZ9AG', 'B002JEYXSK', 'B004VLVOKY', 'B002JF61XO', 'B000FFRTVI', 'B006NWITL6', 'B0017U08M2', 'B00COACXMC', 'B008LOMEU6', 'B00474G8LK', 'B0025UNWWQ', 'B002NX5EC6', 'B00CPT0YDW', 'B00099XODM', 'B0017U24LA', 'B004K0U5JW'], 'bought_together': ['B0083T34SU']}",{'Grocery & Gourmet Food': 898},[['Grocery & Gourmet Food']],21.99,GoGo Rice
16687,B000GFYRHG,"The Bigelow&reg; Tea StoryBeginning the moment our founder, Ruth Campbell Bigelow created ""Constant Comment""&reg; Tea in her kitchen in 1945, our family has focused on just one thing&#x85;trying to make the finest teas possible. Over the years we have introduced many new flavors as well as concepts in tea. Today we offer a selection of deliciously different blends of teas and green teas, a wide variety of herbal teas and teas flavored with real fruit juice. Today Bigelow Tea is the number one specialty tea company in the United States. And to think it all began with the first legendary black tea flavored with golden orange rind and sweet spice&#x85;""Constant Comment""&reg;Tea.Bigelow takes immense pride in providing the tea drinking community with the best tea at a great value. We only use hand- picked teas, real spices, flavors and herbs. The flavors and blends we have created are second to none. Some of our teas contain up to twenty different ingredients! And because tea is a leaf that can dry out we take steps to protect it. To keep the teas fresh, we seal our tea bags in protective packets. We simply have to protect those delightful flavors. That&#x92;s why a cup of Bigelow Tea is aromatic and delicious; a true indulgence for the senses.","Bigelow Constant Comment Tea, 20-Count Boxes (Pack of 6)",http://ecx.images-amazon.com/images/I/512Qe3PeyHL._SX300_.jpg,"{'also_bought': ['B000GFYRK8', 'B000GG0BPM', 'B000GG0BPW', 'B000R4G4PO', 'B00GEG40KA', 'B003D4F2US', 'B0099WPOJ2', 'B000F4H5H2', 'B000F4F952', 'B000CQG8K8', 'B000R4HQOW', 'B00286KM8E', 'B0099VR7S4', 'B0076OK56M', 'B000E63L8S', 'B0019VLUHQ', 'B009L6Q2YW', 'B000E65OF6', 'B0098ZKD3M', 'B000CQG87Q', 'B00CQ7T1WS', 'B000E682EG', 'B002YJC990', 'B004ED9VX6', 'B002YJCAKI', 'B00EIA1EYY', 'B00CRAU3LM', 'B00451ZJB0', 'B00CQB9VSI', 'B000F3N7AC', 'B00CHHKDII', 'B000F4H5GI', 'B000E6LBXK', 'B000CQE42M', 'B00G3KU0X8', 'B00CHI0SKU', 'B000FDDETG', 'B000F4DKBC', 'B005Q8BL72', 'B00B4IGS3U', 'B000EJR49M', 'B000F70R9C', 'B000E63LBU', 'B005Q8BL9A', 'B0009F3PM6', 'B000E63L6U', 'B0045H264C', 'B007M8FRU6', 'B000E671X4', 'B00JWXMYUU', 'B00DUQDIKU', 'B0016BFR4G', 'B00503DOY6', 'B005Q8BIK2', 'B001M09BQQ', 'B007UZNS5W', 'B00BGN8PLG', 'B001E52Z58', 'B001M0AKWA', 'B000V7MCBC', 'B000LKZL76', 'B00F8LX34G', 'B0078J6NVQ', 'B007636DIW', 'B000XBCBW6', 'B000FMMTHU', 'B00BNHS02Y', 'B0009F3SA0', 'B0078DP5XE', 'B001EQ5JLE', 'B00B90LCJ8', 'B000LTM29M', 'B00008XPOV', 'B0048IABSG', 'B00284TPUC', 'B003PMSTTE', 'B005VOOOM0', 'B002HQCWYM', 'B0009F3QLG', 'B00BY6NN30', 'B000E1FXQ6', 'B000NKL3CG', 'B0052OOYO2', 'B006M1F8E4', 'B00284TR82', 'B006527QH2', 'B0006HWA2I', 'B0010BQB6A', 'B006SA2EMS', 'B005K4Q1YA', 'B009XG6IKI', 'B002R046J2', 'B003VTLR5Y', 'B0089PYRWK', 'B008YD8232', 'B00BLZ2312', 'B005YVU6FY', 'B000ED9L6C', 'B000SHQ73Y', 'B001EO5Q64'], 'also_viewed': ['B003D4F2US', 'B0010BQB6A', 'B0076OK56M', 'B00GEG40KA', 'B000R4G4PO', 'B0099VR7S4', 'B000F4H5H2', 'B000GG0BPM', 'B00GEG4276', 'B000WB1YSE', 'B0042IMPTU', 'B004E3EKD2', 'B0099WPOJ2', 'B000GG0BPW', 'B0016BFR4G', 'B003UL8S32', 'B00GEG40LY', 'B001467JYO', 'B001EQ4ORY', 'B0015IMYIM', 'B000GFYRK8', 'B005SHO0R4', 'B000GG0BLQ', 'B000Z92WFC', 'B00032GQLC', 'B00028Q96E', 'B00061EPN6', 'B001H9033M', 'B0034KULNY', 'B00028Q964', 'B00138YJ0K', 'B000SR57YY', 'B00GEG40NM', 'B000NIFO96', 'B0016BCEE2', 'B002C37TM0', 'B005Q8BL9A', 'B0034KQPGQ', 'B00028Q8WY', 'B00028Q946', 'B00028Q8V0', 'B000Z94HXW', 'B00028Q8WO', 'B00028Q96O', 'B00LE6YPDM', 'B00028Q95A', 'B0016JKXGU', 'B005Q8BIK2', 'B007F1JLZM', 'B000F4F952', 'B0018OTDG4', 'B0018QBX6K', 'B0009F3SC8', 'B000E682D2', 'B003MZFL8G', 'B00CQ7T5M4', 'B0014N3FV8', 'B000CQE42M', 'B002LME6OQ', 'B0000CELU7'], 'bought_together': ['B003D4F2US', 'B008JKU2CO']}",{'Grocery & Gourmet Food': 3101},[['Grocery & Gourmet Food']],17.64,Bigelow Tea
